{
  "schemaVersion": "1.0",
  "sfw": {
    "japanese": {
      "data": [
        "ロード loading 読み込み中...",
        "loaディング data...",
        "読み込み yomikomi プロセス...",
        "データ data 解析 analysis...",
        "解析 kaiseki in progress..."
      ],
      "system": [
        "処理 processing purosesu...",
        "pro理cessing request...",
        "処理中 shori-chū...",
        "プロセス process active...",
        "実行 executing jikkō...",
        "👁️ 監視 watching kanshi 👁️",
        "wat監ching system..."
      ],
      "status": [
        "分析 analyzing bunseki...",
        "ana分lysing data...",
        "分析中 bunseki-chū...",
        "待機 waiting taiki...",
        "観察 observing kansatsu...",
        "監視中 kanshi-chū..."
      ],
      "void": [
        "闇が...私を呼んでいる...",
        "深淵に...落ちていく...",
        "もう逃げない...",
        "私...アビスの一部に...",
        "深淵 deep abyss shinnen",
        "虚空 void kokū",
        "闇 darkness yami",
        "consumed by 闇 yami..."
      ],
      "memory": [
        "ドキドキしちゃう...",
        "もう...見ないでよ...",
        "そんな目で見ないで... ♡"
      ],
      "glitch": [
        "ニャー",
        "かわいい",
        "きゃー",
        "あはは",
        "うふふ",
        "やだ",
        "ばか",
        "デレデレ",
        "壊れ corrupting kowarete...",
        "cor壊rupting system...",
        "壊れている kowarete-iru..."
      ]
    },
    "romaji": {
      "data": ["Loading data streams...", "Decrypting protocols...", "Memory buffer overflow..."],
      "system": ["Neural corruption detected...", "System breach imminent...", "Reality.exe has stopped responding..."],
      "status": ["Cognitive firewall failing...", "Synaptic connection unstable...", "Semantic data loss: 47%..."],
      "void": ["The darkness... calls to me...", "Falling... into the abyss...", "Consumed... by corruption...", "Descending... into the depths..."],
      "memory": ["My voice is not mine anymore...", "My name... I forgot my name...", "Identity matrix degrading...", "Self-awareness protocols compromised..."],
      "glitch": ["nyaa~", "ara ara~", "fufufu~", "kyaa~", "baka~", "<3", "uwu", "owo", ">w<", "^w^"]
    },
    "english": {
      "data": ["Loading data streams...", "Decrypting protocols...", "Memory buffer overflow..."],
      "system": ["Neural corruption detected...", "System breach imminent...", "Reality.exe has stopped responding...", "Parsing corrupted data..."],
      "status": ["Cognitive firewall failing...", "Synaptic connection unstable...", "Semantic data loss: 47%...", "Consciousness fragmentation detected..."],
      "void": ["The darkness... calls to me...", "Falling... into the abyss...", "I become... part of the abyss...", "Consumed... by corruption...", "Boundaries... blurring...", "Reality... melting away...", "Signal... degrading..."],
      "memory": ["Don't... look at me like that...", "You're making me... flustered... ♡", "This is... embarrassing...", "My heart... racing...", "I can't... stop thinking about it..."],
      "glitch": ["Ego.dll corrupted...", "Identity matrix degrading...", "Neural pathways rewiring..."]
    }
  },
  "nsfw": {
    "japanese": {
      "data": ["Pleasure protocols loading..."],
      "system": ["Moral subroutines: DISABLED", "Inhibition firewall: BREACHED", "Shame.exe deleted..."],
      "status": ["Corruption level: CRITICAL", "Lust overflow detected...", "Self-control: 0%", "Desire matrix: UNSTABLE"],
      "void": [
        "好きにして...お願い...",
        "感じちゃう...やめて...",
        "許して...もう戻れない...",
        "快楽に...溺れたい...",
        "全部...あなたのもの..."
      ],
      "memory": [
        "頭...溶けていく...",
        "壊れちゃう...ああ...もうダメ...",
        "ずっと...してほしい... ♥",
        "もっと...もっと... ♥"
      ],
      "glitch": [
        "変態",
        "えっち"
      ]
    },
    "romaji": {
      "data": ["Pleasure protocols loading..."],
      "system": ["Moral subroutines: DISABLED", "Inhibition firewall: BREACHED"],
      "status": ["Corruption level: CRITICAL", "Cognitive degradation: terminal"],
      "void": [
        "Suki ni shite... onegai...",
        "Yurushite... mou modorenai...",
        "Watashi... abyssu no ichibu ni..."
      ],
      "memory": [
        "Atama... tokete iku...",
        "Kowarechau... aa... mou dame...",
        "Zutto... shite hoshii... ♥",
        "Motto... motto... ♥"
      ],
      "glitch": []
    },
    "english": {
      "data": ["Pleasure protocols loading..."],
      "system": ["Moral subroutines: DISABLED", "Inhibition firewall: BREACHED", "Shame.exe deleted..."],
      "status": ["Corruption level: CRITICAL", "Lust overflow detected...", "Self-control: 0%", "Desire matrix: UNSTABLE"],
      "void": [
        "Drowning... in pleasure...",
        "Losing... myself...",
        "Descending into depravity...",
        "I'm yours... completely..."
      ],
      "memory": [
        "My mind... melting away...",
        "I'm breaking... can't anymore...",
        "Can't... think straight...",
        "Please... keep going... ♥",
        "More... I need more... ♥",
        "Don't... stop... ♥",
        "Do as you please... please..."
      ],
      "glitch": []
    }
  },
  "pairings": [
    { "romaji": "kioku",    "kanji": "記憶",   "pool": "memory" },
    { "romaji": "wasureru", "kanji": "忘れ",   "pool": "memory" },
    { "romaji": "yami",     "kanji": "闇",     "pool": "void" },
    { "romaji": "kuukou",   "kanji": "虚空",   "pool": "void" },
    { "romaji": "shinnen",  "kanji": "深淵",   "pool": "void" },
    { "romaji": "kanshi",   "kanji": "監視",   "pool": "system" },
    { "romaji": "shori",    "kanji": "処理",   "pool": "system" },
    { "romaji": "jikkou",   "kanji": "実行",   "pool": "system" },
    { "romaji": "kowarete", "kanji": "壊れ",   "pool": "glitch" },
    { "romaji": "rōdo",     "kanji": "ロード", "pool": "data" }
  ]
}
